{
  "meta": {
    "project": "BRERC Public Dashboard \u2014 Front-End (web/)",
    "description": "Public-facing interactive environmental/species-records dashboard for BRERC (Bristol Regional Environmental Records Centre), delivered by 180 Degrees Consulting Bristol. This plan covers ONLY the React public front-end in web/ (Michael Samuel's scope). The backend API + PostgreSQL/PostGIS are owned within the 5-person team and appear here as a flagged dependency (assumptions[] + apiContract[]), never as Michael's build. R8 (internal dashboard) is a clearly deferred, secondary shell phase, conditional on team assignment of internal-web/.",
    "client": "Bristol Regional Environmental Records Centre (BRERC)",
    "clientContact": "Tim Corner (BRERC Manager)",
    "consultancy": "180 Degrees Consulting Bristol",
    "consultancyReviewer": "Jaslyn Leong (Head of Data Science, 180DC)",
    "owner": "Michael Samuel",
    "ownerScope": "Public dashboard front-end only (the React app in web/). Not the api/ backend, not internal-web/ (R8) unless the team explicitly assigns it to Michael. Backend API + PostgreSQL/PostGIS are a dependency + flagged assumption. R8 appears only as a deferred, secondary phase whose front-end deliverables are conditional on both (a) R1-R7 Definition of Done being met and (b) the team assigning internal-web/ to Michael; otherwise P8 reduces to a spike + handover note to the internal-web/ owner.",
    "team": "5 part-time student consultants",
    "engagementWeeks": 8,
    "ownerHoursPerWeek": "ASSUMED ~10-12 hours/week for one part-time student owner (A15). Phase sizing is back-solved against this: ~5 available working weeks between today (2026-07-08) and the final presentation (w/c 2026-08-10), i.e. roughly 50-60 owner-hours total for P0-P6.5, with P7 hardening + handover in the final-presentation..showcase week. If the real hours differ, phase depth (not the DoD gates) is what flexes \u2014 see timeline.deScopeDecisionTree.",
    "today": "2026-07-08",
    "milestones": {
      "kickoff": "2026-07-01",
      "midReview": "2026-07-24",
      "finalPresentation": "w/c 2026-08-10",
      "showcase": "2026-08-17"
    },
    "sourceDocs": [
      "CLAUDE.md (Engineering Master Prompt 2 of 2, repo root)",
      "BRERC Strategy, Design & Consulting Master Prompt (companion, referenced)",
      "varied/reptile sample from main5.xls (19-column dev subset shape) \u2014 described in the brief; the file itself is NOT in the repo (A16)",
      "180DC Bristol engagement brief (POTENTIAL areas/outcomes \u2014 candidates, not commitments)",
      "Public Sector Bodies (Websites and Mobile Applications) Accessibility Regulations 2018 (PSBAR)"
    ],
    "repoReality": "Monorepo on branch michael/phase-0-foundations. web/ (Michael), api/ (team), internal-web/ (R8, secondary). GREENFIELD: no web/package.json yet; only scaffold dirs (web/src, web/public, web/tests). CLAUDE.md adopted; stray build artefacts removed. .github/PULL_REQUEST_TEMPLATE.md ALREADY EXISTS (extend, do not recreate). Dependabot is ALREADY ACTIVE with open branches on web/ + api/ (incl. a node-26 bump vs ground-truth Node 25) \u2014 the first web/package.json commit will trigger a wave of PRs to triage (RK10). Team workflow: feature branches + PRs, Conventional Commits, no direct pushes to main.",
    "planningLens": "Public-first (R1-R7 before R8); every phase/step traceable to a requirement id; dependsOn acyclic; realistic for one part-time front-end owner in ~5 working weeks. Data honesty + C2 (PII / sensitive-species) enforced by types, strict Zod, a CI grep-guard, contract tests, and e2e wire inspection \u2014 with server-side enforcement flagged as team-owned assumptions, and client-side checks framed as nets, not fixes.",
    "generated": "TBD"
  },
  "requirements": [
    {
      "id": "R1",
      "title": "Public-facing interactive live dashboard hosted on BRERC's website",
      "priority": "primary",
      "source": "brief + CLAUDE.md \u00a715",
      "notes": "PRIMARY, centre of gravity. Self-contained statically-served SPA / embeddable bundle with a documented build output. Everything else serves this; public-first ordering is mandatory."
    },
    {
      "id": "R2",
      "title": "Interactive species distribution maps (grid-reference aware)",
      "priority": "primary",
      "source": "brief + CLAUDE.md \u00a76, \u00a715",
      "notes": "Likely centrepiece. MapLibre GL JS via react-map-gl/maplibre. Honest grid/atlas cells at true precision, NOT false-precision pins. Data reprojected 27700->4326 server-side; client renders WGS84 (4326) only."
    },
    {
      "id": "R3",
      "title": "Species information + attributed/licensed images",
      "priority": "primary",
      "source": "brief + CLAUDE.md \u00a715",
      "notes": "e.g. Wikipedia/Wikimedia CC BY-SA / PD imagery, with visible attribution + licence and meaningful alt text. Covers species AND geodiversity where in scope."
    },
    {
      "id": "R4",
      "title": "Engaging, user-friendly, visually appealing UX for non-expert public",
      "priority": "primary",
      "source": "brief + CLAUDE.md \u00a715",
      "notes": "Colour, fonts, navigation. Design tokens centralise colour so contrast is auditable (ties to R5). Product/UX/visual decisions defer to the Strategy prompt."
    },
    {
      "id": "R5",
      "title": "Accessibility WCAG 2.2 AA + published accessibility statement",
      "priority": "primary",
      "source": "brief + CLAUDE.md \u00a78, \u00a715 (PSBAR 2018)",
      "notes": "LEGAL build-blocker. Automated axe AND manual keyboard/screen-reader pass. Non-map fallback (accessible table/summary) mandatory. A cross on R5 blocks merge."
    },
    {
      "id": "R6",
      "title": "Live PostgreSQL; dev subset now -> prod credential swap, config-only",
      "priority": "primary",
      "source": "brief + CLAUDE.md \u00a73, \u00a75, \u00a715",
      "notes": "The credential swap lives entirely in the API environment. The client only knows an API base URL (+ map style/tile URLs) via VITE_* (public). No DB credentials, tokens, or SQL ever in the client. dev->prod is not a client code change."
    },
    {
      "id": "R7",
      "title": "Fully documented + commented source + technical docs for handover",
      "priority": "primary",
      "source": "brief + CLAUDE.md \u00a713, \u00a715",
      "notes": "README, .env.example, ADRs, handover runbook, accessibility statement, why-not-what comments (esp. grid-ref/projection + sensitivity logic). Deliverable."
    },
    {
      "id": "R8",
      "title": "Internal staff monitoring dashboard (summary stats + data-quality checks + reporting)",
      "priority": "secondary",
      "source": "brief + CLAUDE.md \u00a715",
      "notes": "SECONDARY. Only if R1-R7 DoD is met, time permits, AND the team assigns internal-web/ to Michael. Summary stats over records/species/Recorder1/years/ dates/BLISS; filtering; data-quality checks (invalid grid refs, bad dates, carriage returns, missing values, duplicates); reporting. Lives in internal-web/; represented here only as a deferred shell/spike phase."
    },
    {
      "id": "C1",
      "title": "8-week public-first scope, refined with BRERC",
      "priority": "constraint",
      "source": "brief + CLAUDE.md \u00a715",
      "notes": "Brief lists POTENTIAL work \u2014 candidates, not commitments. Scope refined WITH Tim Corner; never invent requirements; never treat feature ideas as fixed."
    },
    {
      "id": "C2",
      "title": "Data ethics \u2014 sensitive species + recorder PII/GDPR",
      "priority": "constraint",
      "source": "brief + CLAUDE.md \u00a73, \u00a76, \u00a715",
      "notes": "HARD STOP if violated. Sensitive-species precise coords generalised/suppressed server-side and made INDISTINGUISHABLE (no sensitivity marker in public payloads); Recorder1/PII never reach the client; Comments withheld entirely from public; Place suppressed for sensitive taxa; low-count re-identification bucketed server-side. A client-side-only fix = a contract bug to flag. A cross blocks merge."
    },
    {
      "id": "C3",
      "title": "Maintainable by BRERC staff post-handover",
      "priority": "constraint",
      "source": "brief + CLAUDE.md \u00a713, \u00a715",
      "notes": "Boring, well-understood patterns; no hidden magic; documented decisions; docs current in-repo. Partner to R7."
    }
  ],
  "assumptions": [
    {
      "id": "A1",
      "statement": "A team-owned backend API exists (or will exist) exposing HTTPS/JSON and/or vector-tile endpoints at a single base URL read from config. The React client never connects to PostgreSQL and holds no DB credentials.",
      "why_it_matters": "The entire front-end data layer (lib/api), the apiContract, and the MSW mock are built against this boundary. If the API is late, the front-end proceeds against the MSW mock and swaps only VITE_API_BASE_URL at integration (P6.5).",
      "confirm_with": "Team (backend/API owner) + Tim Corner",
      "status": "assumed"
    },
    {
      "id": "A2",
      "statement": "The API reprojects EPSG:27700 (Eastings/Northings) -> EPSG:4326 (WGS84) via ST_Transform server-side and returns WGS84 grid-cell geometry + precision, never raw BNG eastings/northings or false-precision points.",
      "why_it_matters": "MapLibre renders Web Mercator and needs 4326; raw BNG is both a rendering bug and (at full precision) a C2 location leak.",
      "confirm_with": "Team (backend/API owner)",
      "status": "assumed"
    },
    {
      "id": "A3",
      "statement": "The API strips Recorder1 and all recorder PII, and WITHHOLDS the free-text Comments field entirely from public responses (no sanitise-and-ship path), server-side, before any public response leaves the API.",